{
  "schema_version": "4.1",
  "research_output_id": "synthetic-output-001",
  "question": "某数据中心电力组件公司是否值得进入下一轮研究？",
  "market": "US",
  "mode": "standard",
  "research_cutoff": "2026-09-12T00:00:00Z",
  "as_of": "2026-09-12T00:00:00Z",
  "bottleneck_assessment_ids": ["bottleneck:synthetic-power"],
  "company_profile_ids": ["company:synthetic-power"],
  "market_snapshot_ids": ["snapshot:synthetic-power"],
  "valuation_snapshot_ids": ["valuation:synthetic-power"],
  "primary_candidate_id": "company:synthetic-power",
  "priority": "medium",
  "research_conclusion": "tentative",
  "research_language": "conditional_interest",
  "method_application": {
    "status": "no_approved_match",
    "cards": []
  },
  "historical_thesis_timeline": {
    "status": "none_found",
    "event_ids": []
  },
  "why_research_now": "The system constraint is plausible, but the company-level value capture and current market data still require verification.",
  "validation_ladder": [
    {"stage":"architecture_necessity","status":"partial","claim":"The target deployment architecture appears to require the specified power-conversion module, but redesign cost is not fully quantified.","evidence_ids":["evidence:synthetic-1"],"missing_proof":["Alternative architecture performance and timing penalty"]},
    {"stage":"physical_supply","status":"partial","claim":"Specialized equipment and a yield ramp may restrict immediately usable supply.","evidence_ids":["evidence:synthetic-2"],"missing_proof":["Qualified and merchant capacity"]},
    {"stage":"customer_validation","status":"partial","claim":"Customer urgency and qualification are plausible but a binding customer document is absent.","evidence_ids":["evidence:synthetic-1"],"missing_proof":["Named qualification or repeat order"]},
    {"stage":"company_capture","status":"partial","claim":"The company has a relevant segment, but direct customer exposure and pricing capture remain incomplete.","evidence_ids":["evidence:synthetic-1"],"missing_proof":["Segment margin and contract economics"]},
    {"stage":"financial_transmission","status":"partial","claim":"The operating path can be stated, but cash conversion and dilution are not fully verified.","evidence_ids":["evidence:synthetic-1"],"missing_proof":["Working capital, capex, and share-count bridge"]},
    {"stage":"market_expectations","status":"not_established","claim":"A dated market snapshot and expectation proxy are required before calling the opportunity underappreciated.","evidence_ids":["evidence:synthetic-3"],"missing_proof":["Authoritative quote, market-cap basis, and expectation proxy"]}
  ],
  "reflexivity_check": {
    "social_originated": null,
    "author_market_influence": "unknown",
    "post_precedes_price_move": "unknown",
    "independent_fundamental_confirmation": "unknown",
    "price_action_is_independent_evidence": "unknown",
    "evidence_ids": [],
    "notes": "No social-origin or post-price sequence is present in this synthetic fixture; do not use price movement as fundamental confirmation."
  },
  "conditional_reasons": [
    {
      "condition": "Customer qualification and repeat orders are confirmed in a dated primary source.",
      "implication": "The company may capture part of the constrained power-delivery economics.",
      "mechanism": "Qualification can reduce substitution and support repeat volume at the required specification.",
      "confirm_with": "Next filing, customer project document, or dated order/production metric within two reporting periods.",
      "fail_if": "A qualified alternate appears or reported margins and repeat volume deteriorate.",
      "evidence_ids": ["evidence:synthetic-1"],
      "status": "open"
    }
  ],
  "variant_perception": {
    "market_proxy": "The current market snapshot is unavailable in this synthetic fixture.",
    "what_market_appears_to_price": "UNKNOWN",
    "what_may_be_missing": "UNKNOWN until a dated price, share count, and market-cap basis are available.",
    "hypothesis": "The market may underappreciate qualification duration, but this is not established.",
    "evidence_ids": ["evidence:synthetic-1"],
    "confidence": "low",
    "unknowns": ["Current quote, shares, market cap, and market-implied expectations."],
    "disconfirming_check": "Obtain an authoritative dated market snapshot and compare the implied expectation with the operating bridge."
  },
  "catalysts": [
    {
      "catalyst": "A dated qualification or production milestone.",
      "time_window": "Next two reporting periods",
      "confirmation_metric": "Qualified capacity and recognized segment revenue",
      "failure_risk": "Milestone slips or only reflects management guidance.",
      "evidence_ids": ["evidence:synthetic-1"]
    }
  ],
  "counterarguments": [
    {
      "argument": "The component may be replaceable and the company may only have thematic exposure.",
      "evidence_ids": ["evidence:synthetic-2"],
      "effect_on_thesis": "Downgrade the bottleneck and company value-capture conclusions to not established."
    }
  ],
  "invalidation_conditions": [
    "Independent alternatives qualify without a meaningful redesign.",
    "The relevant segment remains immaterial or margins compress despite volume."
  ],
  "next_checks": [
    {
      "unknown": "Whether the company has direct qualified exposure.",
      "resolving_source_or_metric": "Exchange filing, customer filing, or project document.",
      "next_action": "Verify the chain position and segment economics before ranking the company."
    }
  ],
  "claim_ids": ["claim:synthetic-1"],
  "evidence_ids": ["evidence:synthetic-1", "evidence:synthetic-2", "evidence:synthetic-3"],
  "no_trade_execution": true,
  "no_return_prediction": true,
  "access_level": "synthetic",
  "source_partition": "synthetic",
  "source_lineage": [
    {
      "source_partition": "synthetic",
      "source_record_id": "fixture:research-output-001",
      "source_locator": "synthetic://research-output-001",
      "content_hash": "0000000000000000000000000000000000000000000000000000000000000000",
      "published_at": "2026-09-12T00:00:00Z",
      "known_at": "2026-09-12T00:00:00Z"
    }
  ],
  "review_status": "human_reviewed",
  "extraction_version": "synthetic-v4.1"
}
